Sentence ,Masked Sentence,Options,Truth,Options,Rule
"If his crime is great, so will his punishment be heavy.","If his crime<***>great, so <***> his punishment be heavy.","is,are*will,shall",is*will,,S_V
"Lead on, cried the peddler, dropping his pack from his shoulders, and advancing towards the door with a manner of incomprehensible dignity.","Lead on, <***> the peddler, <***> his pack from his shoulders, and advancing towards the door with a manner of incomprehensible dignity.","cried,cries*dropping,dropped",cried*cdropping,,S_V
"No, said the major, recoiling in horror at his own justice.","<***>, said the major, <***>in horror at his own justice.","No,not*recalling,recalls",No*recalling,,N_P_I*S_V
The customer that the shopkeepers hate congratulated himself when he won the lottery and was gifted a car,The customer that the shopkeepers hate congratulated <***> when he won the lottery and <***> gifted a car,"himself,themselves*was,were",himself*was,,R_A*S_V
"The interruption caused by this scene prevented further enjoyment around the table, and the officers dispersed to their several places of rest.","The interruption <***> by this scene prevented further enjoyment around the table, and the officers <***>to their several places of rest.","caused,causes*dispersed,disperses",caused*dispersed,,S_V
The officer to whose keeping Dunwoodie had committed the peddler transferred his charge to the custody of the regular sergeant of the guard.,The officer to whose keeping Dunwoodie <***>committed the peddler <***> his charge to the custody of the regular sergeant of the guard.,"had,have*transferred,transfers",had*transferred ,,S_V
"The sergeant was more than fifty years of age, and for half that period he had borne arms.","The sergeant <***>more than fifty years of age, and for half that period he <***> borne arms.","was,were*had,have",was*had,,S_V
Captain Lawton had rewarded his fidelity by making him its orderly.,Captain Lawton <***> rewarded his fidelity by <***> him its orderly.,"had,have*making,makes",had*making,,S_V
"Seating himself on a cask, that contained some of Betty's favorite beverage, the sergeant motioned to Birch to occupy another, in the same manner.","Seating <***> on a cask, that contained some of Betty's favorite beverage, the sergeant <***> to Birch to occupy another, in the same manner.","himself,herself*motioned,motion",himself*motioned,,R_A*S_V
"The lantern was placed on the floor, when the dragoon, after looking his prisoner steadily in the face, observed,-","The lantern <***> placed on the floor, when the dragoon, after <***> his prisoner steadily in the face, observed,-","was,were*looking,looks",was*looking ,,S_V
"This is a fearful place to prepare for the last change in, said Harvey, gazing around his little prison with a vacant eye.","This <***> a fearful place to prepare for the last change in, said Harvey, <***> around his little prison with a vacant eye.","is,are*gazing,gaze",is*gazing,,S_V
"While speaking, he took a Bible from his pocket, and offered it to the peddler.","While speaking, he <***> a Bible from his pocket, and <***> it to the peddler.","took,take*offered,offers",took*offered,,S_V
"There are few who have not done so, said the peddler, turning his vacant gaze once more on his companion.","There <***> <***> who have not done so, said the peddler, turning his vacant gaze once more on his companion.","are,is*few,no",are*few,,S_V*N_P_I
True - 'tis natural to sin; but it sometimes happens that a man does what at other times he may be sorry for.,True - 'tis natural to sin; but it sometimes happens that a man <***> what at other times he <***> be sorry for.,"does,do*may,might",does*may,,S_V
"One would not wish to die with any very heavy sin on his conscience, after all.","One <***><***> wish to die with any very heavy sin on his conscience, after all.","would,should*not,none",would*not,,S_V*N_P_I
"Harvey had by this time thoroughly examined the place in which he was to pass the night, and saw no means of escape.","Harvey <***> by this time thoroughly <***> the place in which he was to pass the night, and saw no means of escape.","had,have*examined,examines",had*examined,,S_V
"I have been taught to lay the burden of my sins at the feet of my Savior, replied the peddler.","I<***> been taught to lay the burden of my sins at the feet of my Savior, <***>the peddler.","have,has*replied,replies",have*replied,,S_V
"Why, yes - all that is well enough, return the other.","Why, yes - all that <***> well enough, <***> the other.","is,are*return,returns",is*return,,S_V
"These hands,"" said the peddler, stretching forth his meager, bony fingers, ""have spent years in toil, but not a moment in pilfering.""","These hands,"" <***>the peddler, stretching forth his meager, bony fingers, ""<***> spent years in toil, but not a moment in pilfering.""","said,says*have,has",said*have,,S_V
"It is well that it is so, said the honest-hearted soldier, ""and, no doubt, you now feel it a great consolation.","It <***> well that it is so, <***> the honest-hearted soldier, ""and, no doubt, you now feel it a great consolation.","is,are*said,says",is*said,,S_V
"Thank God! said Birch, with fervor, ""I have never yet taken the life of a fellow creature.""","Thank God! said Birch, with fervor, ""I <***><***> yet taken the life of a fellow creature.""","have,has*never,no",have*never,,S_V*N_P_I
"I never was a soldier, therefore never could desert,"" said the peddler, resting his face on his hand in a melancholy attitude.","I <***> <***> a soldier, therefore never could desert,"" said the peddler, resting his face on his hand in a melancholy attitude.","never,no*was,were",never*was,,N_P_I*S_V
"I recommend you to say your prayers, and then to get some rest, in order that you may do both.","I<***> you to say your prayers, and then to get some rest, in order that you <***> do both.","recommend,recommend*may,might",recommend*may,,S_V
It is now too late - I have destroyed my only safeguard.,It<***> now too late - I <***> destroyed my only safeguard.,"is,are*have,has",is*have,,S_V
"Tis nothing, replied the peddler, recovering his natural manner, and lowering his face to avoid the earnest looks of his companion.","Tis nothing, <***> the peddler, <***> his natural manner, and lowering his face to avoid the earnest looks of his companion.","replied,replies*recovering,recover",replied*recovering,,S_V
"No one, added Harvey, anxious to say no more.","<***> one, <***> Harvey, anxious to say no more.","No,not*added,adds",No*added,,N_P_I*S_V
"Nothing and no one can avail but little now, said the sergeant, rising to go.","Nothing and no one can avail but little now, <***> the sergeant, <***> to go.","said,says*rising,rises",said*rising,,S_V
"Then you might save me from this ignominious death, said Birch, springing to his feet, and catching the dragoon by the arm.","Then you may <***> me from this ignominious death, <***> Birch, springing to his feet, and catching the dragoon by the arm.","save,saves*said,says",save*said,,S_V
"And, oh! what will I not give you in reward!","And, oh! what <***> I <***> give you in reward!","will,shall*not,no",will*not,,S_V*N_P_I
"In what manner? asked the sergeant, looking at him in surprise.","In what manner? <***> the sergeant, <***> at him in surprise.","asked,asks*looking,looked",asked*looking ,,S_V
"Go - go, poor wretch, and make your peace with God; for it is He only that can be of service to you now.","Go - go, poor wretch, and<***> your peace with God; for it <***> He only that can be of service to you now.","make,makes*is,are",make*is,,S_V
"The sergeant took up the lantern, and, with some indignation in his manner, he left the peddler to sorrowful meditations on his approaching fate.","The sergeant <***> up the lantern, and, with some indignation in his manner, he<***> the peddler to sorrowful meditations on his approaching fate.","took,take*left,lefted",took*left,,S_V
"Hollister concluded his injunctions to the man in the shed, by saying, ""Your life will depend on his not escaping.","Hollister <***> his injunctions to the man in the shed, by saying, ""Your life <***> depend on his not escaping.","concluded,conclude*will,shall",concluded*will,,S_V
The surgeons that hate the driver cry when the driver gets them in trouble by reporting them.,The surgeons that hate the driver <***> when the driver <***> them in trouble by reporting them.,"cry,cries*get,gets",cry*gets,,S_V
"But, said the trooper, ""my orders are, to let the washerwoman pass in and out, as she pleases.""","But, <***> the trooper, ""my orders <***>, to let the washerwoman pass in and out, as she pleases.""","said,says*are,is",said*are,,S_V
"Well, let her then; but be careful that this wily peddler does not get out in the folds of her petticoats.","Well, let her then; but be careful that this wily peddler <***> <***> out in the folds of her petticoats.","doesn't,don't*get,gets",doesn't*get,,N_P_I*S_V
"He then continued his walk, giving similar orders to each of the sentinels near the spot.","He then <***> his walk, <***>similar orders to each of the sentinels near the spot.","contnued,continues*giving,gives",contnued*giving,,S_V
"The sentinel, who felt nettled at the contempt of the peddler, after communicating his orders, while he was retiring, exclaimed to his successor,-","The sentinel, who <***>nettled at the contempt of the peddler, after communicating his orders, while he <***> retiring, exclaimed to his successor,-","felt,fell*was,were",felt*was,,S_V
"The joke was followed by a general laugh from the party, who marched on in performance of their duty.","The joke <***> followed by a general laugh from the party, who <***> on in performance of their duty.","was,am*marched,marches",was*marched,,S_V
"At this instant the door of the prison was opened, and Betty reappeared, staggering back again toward her former quarters.","At this instant the door of the prison <***> opened, and Betty reappeared, <***> back again toward her former quarters.","was,were*staggering,stagger",was*staggering,,S_V
"Stop, said the sentinel, catching her by her clothes; ""are you sure the spy is not in your pocket?""","Stop, said the sentinel, <***> her by her clothes; ""are you sure the spy <***> not in your pocket?""","catching,catches*is,are",catching*is,,S_V
"Can't you hear the rascal snoring in my room, you dirty blackguard? sputtered Betty, her whole frame shaking with rage.","<***> you hear the rascal snoring in my room, you dirty blackguard?<***> Betty, her whole frame shaking with rage.","Can't,won't*sputtered,sputters",Can't*sputtered,,N_P_I*S_V
Do you mind a fellow who's to be hanged in the morning?,<***> you mind a fellow who's to be <***> in the morning?,"Do,does*hanged,hangs",Do*hanged,,S_V
"You see he sleeps already; to-morrow he'll take a longer nap.""","You <***> he <***> already; to-morrow he'll take a longer nap.""","see,sees*sleeps,sleep",see*sleeps,,S_V
"Hands off, ye villain, cried the washerwoman, relinquishing a small bottle that the trooper had succeeded in wresting from her.","Hands off, ye villain, <***>the washerwoman, relinquishing a small bottle that the trooper <***>succeeded in wresting from her.","cried,cries*had,have",cried*had,,S_V
"Silence, old Jezebel! said the fellow with a laugh, taking the bottle from his mouth to breathe, ""or you will wake the gentleman.","Silence, old Jezebel! said the fellow with a laugh, <***> the bottle from his mouth to breathe, ""or you <***> wake the gentleman.","taking,takes*will,shall",taking*will,,S_V
"The Skinners followed Captain Lawton with alacrity, towards the quarters occupied by the troop of that gentleman.","The Skinners <***> Captain Lawton with alacrity, towards the quarters <***>by the troop of that gentleman.","followed,follows*occupied,occupies",followed*occupied,,S_V
"His intrepidity was mistaken by others for ferocity; and his hasty zeal, for the natural love of cruelty.","His intrepidity <***> mistaken by <***> for ferocity; and his hasty zeal, for the natural love of cruelty.","was,were*others,other",was*others,,S_V
"It is seldom that either popular condemnation or popular applause falls, exactly in the quantities earned, where it is merited.","It<***> seldom that either popular condemnation or popular applause falls, exactly in the quantities earned, where it <***> merited.","is,was*is,are",is*is,,S_V
"Drawing near his conductor, therefore, the leader commenced a confidential dialogue.","<***> near his conductor, therefore, the leader <***>a confidential dialogue.","drawing,draws*commenced,commence",drawing*commenced,,S_V
"This is always well for a man to know his friends from his enemies, said the half-licensed freebooter.","This <***> always well for a man to know his friends from his enemies, <***>the half-licensed freebooter.","is,are*said,says",is*said,,S_V
To this prefatory observation the captain made no other reply than a sound which the other interpreted into assent.,To this prefatory observation the captain<***> no other reply than a sound which the other <***>into assent.,"made,mades*interpreted,interpret",made*interpreted,,S_V
"Many of the friends of Congress in this county, the man proceeded, ""wish the horse was led by some other officer.","Many of the friends of Congress in this county, the man <***>, ""wish the horse <***> led by some other officer.","proceeded,proceed*was,were",proceeded*was,,S_V
"But how? asked Lawton, a little impatiently, and quickening his step to get out of the hearing of the rest of the party.","But how? <***>Lawton, a little impatiently, and<***> his step to get out of the hearing of the rest of the party.","asked,asks*quickening,quickens",asked*quickening,,S_V
"He should not be confounded with other gentlemen of his name and family, many of whom served in the royal army.","He <***> <***> be confounded with other gentlemen of his name and family, many of whom served in the royal army.","should,would*not,never",should*not,,S_V*N_P_I
I thought the Refugees took all that game to themselves.,I <***> the Refugees took all that game to <***>.,"thought,thinks*themselves,ourselves",thought*themselves,,S_V*R_A
They do a little at it; but they are obliged to be sparing among their own people.,They <***> a little at it; but they <***> obliged to be sparing among their own people.,"do,does*are,is",do*are,,S_V
"That was a very dishonorable act, indeed; I wonder that an honorable man will associate with such rascals.""","That <***> a very dishonorable act, indeed; I wonder that an honorable man <***> associate with such rascals.""","was,were*will,shall",was*will,,S_V
"Do you think Major Dunwoodie is to be trusted?""","<***> you think Major Dunwoodie <***> to be trusted?""","Do,does*is,were",Do*is,,S_V
Certainly; you know Arnold was thought well of until the royal major was taken.,Certainly; you know Arnold<***>thought well of until the royal major <***> taken.,"was,were*was,is",was*was,,S_V
"That's just my notion, rejoined the Skinner, with a self-approving manner that showed how much he was satisfied with his own estimate of character.","That's just my notion, <***>the Skinner, with a self-approving manner that showed how much he<***> satisfied with his own estimate of character.","rejoined,rejoin*was,were",rejoined*was,,S_V
"Lawton excused himself for a moment, and entered his quarters.","Lawton<***><***>for a moment, and entered his quarters.","excused,excuses*himself,herself",excused*himself,,S_V*R_A
"Do you think the colonies will finally get the better of the king? he inquired, with a little of the importance of a politician.","Do you think the colonies <***>finally get the better of the king? he<***>, with a little of the importance of a politician.","will,shall*inquired,inquire",will*inquired,,S_V
"Then checking himself, he continued, ""No doubt they will.","Then checking<***>, he continued, ""No doubt they <***>.","himself,herself*will,shall",himself*will,,R_A*S_V
"If the French will give us arms and money, we will drive out the royal troops in six months.""","If the French will <***>  us arms and money, we <***> drive out the royal troops in six months.""","give,gives*will,shall",give*will,,S_V
Not yet - but it will go hard if I do not find one before the peace is made.,<***> yet - but it <***>go hard if I do not find one before the peace is made.,"Not,never*will,shall",Not*will,,N_P_I*S_V
"Aye, fools indeed; King George would have paid them better, for he is richer.","Aye, fools indeed; King George <***>have paid them better, for he <***> richer.","would,won't*is,are",would*is,,S_V
"But, thank God! there is a pervading spirit in the people that seems miraculous.","But, thank God! there <***> a pervading spirit in the people that <***> miraculous.","is,are*seems,seem",is*seems,,S_V
"But ground your arms, you rascals, and see that the money is truly told.","But ground your arms, you rascals, and <***> that the money<***> truly told.","see,sees*is,are",see*is,,S_V
"There is just the money, said the leader; ""and we will now go to our homes, with your permission.""","There <***> just the money, said the leader; ""and we <***> now go to our homes, with your permission.""","is,was*will,shall",is*will,,S_V
The players that the skaters admire embarrassed themselves when they fell down whilst performing ,The players that the skaters admire embarrassed <***> when <***> fell down whilst performing ,"himself,themselves*they,them",themselves*them,,R_A*S_V
"If we meet often, you will be covered with scars, which, if not very honorable, will at least be merited.""","If we <***> often, you <***> be covered with scars, which, if not very honorable, will at least be merited.""","meet,met*will,shall",meet*will,,S_V
"The moon was just rising, and the group of dragoons could easily be distinguished where they had been left.","The moon <***> just rising, and the group of dragoons could easily be distinguished where they <***>been left.","was,were*had,have",was*had,,S_V
"Suddenly turning, the whole gang leveled their pieces and drew the triggers.","Suddenly turning, the whole gang <***> their pieces and <***>the triggers.","leveled,levels*drew,draw",leveled*drew,,S_V
"Ah! rascals, I knew you, and have taken away your flints.","Ah! rascals, I <***> you, and <***> taken away your flints.","knew,knews*have,has",knew*have,,S_V
"You should have taken away that in my pouch, too, shouted the leader, firing his gun in the next instant.","You <***> <***> taken away that in my pouch, too, shouted the leader, firing his gun in the next instant.","should,would*have,had",should*have,,S_V
"The bullet grazed the ear of Lawton, who laughed as he shook his head, saying, ""A miss was as good as a mile.""","The bullet <***> the ear of Lawton, who <***> as he shook his head, saying, ""A miss was as good as a mile.""","grazed,graze*laughed,laughs",grazed*laughed,,S_V
"The patrol departed, and the captain slowly returned to his quarters, with an intention of retiring to rest.","The patrol <***>, and the captain slowly <***> to his quarters, with an intention of retiring to rest.","departed,depart*returned,returns",departed*returned,,S_V
"It is becoming more and more interesting, murmured Gideon Spilett in the sailor's ear, who nodded.","It <***> becoming more and more interesting, <***>Gideon Spilett in the sailor's ear, who nodded.","is,are*murmured,murmurs",is*murmured,,S_V
Harding himself and his companions rushed to the help of their dog.,Harding <***> and his companions <***> to the help of their dog.,"himself,herself*rushed,rushes",himself*rushed,,R_A*S_V
"Top's barking became more and more perceptible, and it seemed strangely fierce.","Top's barking<***> more and more perceptible, and it <***>strangely fierce.","became,become*seemed,seems",became*seemed ,,S_V
Was he engaged in a struggle with some animal whose retreat he had disturbed?,<***> he engaged in a struggle with some animal whose retreat he <***> disturbed?,"Was,were*had,have",Was*had ,,S_V
There were the passage ended in a vast and magnificent cavern.,There <***> the passage <***> in a vast and magnificent cavern.,"were,am*ended,ends",were*ended,,S_V
"There was nothing there, not an animal, not a human being; and yet Top continued to bark.","There <***> nothing there, not an animal, not a human being; and yet Top <***> to bark.","was,were*continued,continues",was*continued ,,S_V
Neither caresses nor threats could make him be silent.,Neither caresses nor threats <***> <***> him be silent.,"could,can't*make,makes",could*make ,,S_V
"There must be a place somewhere, by which the waters of the lake reached the sea, said the engineer.","There <***> be a place somewhere, by which the waters of the lake <***>the sea, said the engineer.","must,might*reached,reaches ",must*reached ,,S_V
"Of course, replied Pencroft, ""and we must take care not to tumble into a hole.""","Of course, <***> Pencroft, ""and we <***> take care not to tumble into a hole.""","replied,replies*must,might",replied*must ,,S_V
"The dog, excited by his master's words, ran towards the extremity of the cavern, and there redoubled his barking.","The dog, <***> by his master's words, <***> towards the extremity of the cavern, and there redoubled his barking.","excited,excite*ran,run",excited*ran ,,S_V
"They followed him, and by the light of the torches, perceived the mouth of a regular well in the granite.","They<***> him, and by the light of the torches, <***>the mouth of a regular well in the granite.","followed,follows*perceived,perceive",followed*perceived,,S_V
The torches were held over the opening: nothing could be seen.,The torches <***> held over the opening: nothing <***> be seen.,"were,was*could,would",were*could,,S_V
"Harding took a lighted branch, and threw it into the abyss.","Harding <***> a lighted branch, and <***> it into the abyss.","took,take*threw,throw",took*threw,,S_V
The floor of the cavern must thus be situated ninety feet above the level of the sea.,The floor of the cavern <***> thus be <***> ninety feet above the level of the sea.,"must,might*situated,situate",must*situated,,S_V
"But it was occupied by some creature, replied Gideon Spilett, whose curiosity was not yet satisfied.","But it <***> occupied by some creature, replied Gideon Spilett, whose curiosity <***> not yet satisfied.","was,were*was,were",was*was,,S_V
"Well, the creature, amphibious or otherwise, has made off through this opening, replied the engineer, ""and has left the place for us.""","Well, the creature, amphibious or otherwise, <***> made off through this opening, replied the engineer, ""and<***> left the place for us.""","has,had*has,have",has*has,,S_V
"Cyrus Harding looked at his dog, and those of his companions who were near him might have heard him murmur these words,--","Cyrus Harding <***>at his dog, and those of his companions who <***> near him might have heard him murmur these words,--","looked,looks*were,was",looked*were ,,S_V
"Yes, I believe that Top knows more than we do about a great many things.","Yes, I <***> that Top knows more than we<***> about a great many things.","believe,believes*do,does",believe*do ,,S_V
"However, the wishes of the settlers were for the most part  was satisfied.","However, the wishes of the settlers <***> for the most part  <***> satisfied.","were,was*was,is",were*was,,S_V
"Chance, aided by the marvelous sagacity of their leader, had done them great service.","Chance, <***> by the marvelous sagacity of their leader, <***> done them great service.","aided,aids*had,hadn't",aided*had ,,S_V
The water which had left it could not return.,The water which <***> left it <***> not return.,"had,have*could,can't",had*could,,S_V
"Then, captain, let us set to work! replied Pencroft.","Then, captain, let us <***> to work! <***> Pencroft.","set,sets*replied,replies",set*replied,,S_V
"I have my pickaxe, and I shall soon make my way through this wall.","I<***> my pickaxe, and I <***> soon make my way through this wall.","have,has*shall,shouldn't",have*shall ,,S_V
"Here,"" replied the engineer, showing the sturdy sailor a considerable recess in the side, which would much diminish the thickness.","Here,"" <***> the engineer, showing the sturdy sailor a considerable recess in the side, which <***>much diminish the thickness.","replied,replies*would,should",replied*would ,,S_V
"Pencroft attacked the granite, and for half an hour, by the light of the torches, he made the splinters fly around him.","Pencroft <***>the granite, and for half an hour, by the light of the torches, he <***> the splinters fly around him.","attacked,attacks*made,mades",attacked*made ,,S_V
"""Where is your sister?"" said he hastily, as he opened the door.","""Where <***> your sister?"" said he hastily, as he <***> the door.","is,are*opened,opens",is*opened ,,S_V
"Harding applied his eye to the aperture, which overlooked the ground from a height of eighty feet.","Harding <***> his eye to the aperture, which <***> the ground from a height of eighty feet.","applied,applies*overlooked,overlook",applied*overlooked,,S_V
"Before him was extended the sea-coast, the islet, and beyond the open sea.","Before him <***> <***>the sea-coast, the islet, and beyond the open sea.","was,were*extended,extends ",was*extended ,,S_V
"Floods of light entered by this hole, inundating the splendid cavern and producing a magic effect!","Floods of light <***> by this hole, <***> the splendid cavern and producing a magic effect!","entered,enters*inundating,inundate",entered*inundating,,S_V
"This cavern was a picturesque mixture of all the styles of Byzantine, Roman, or Gothic architecture ever produced by the hand of man.","This cavern <***> a picturesque mixture of all the styles of Byzantine, Roman, or Gothic architecture ever <***> by the hand of man.","was,were*produced,produces ",was*produced ,,S_V
