Sentence ,Masked Sentence,Options,Truth,Options,Rule
"His brother Sergius Ivanich, Oblonsky, and the Princess directed his actions.
","His brother Sergius Ivanich, Oblonsky, and the Princess <***> directed his <***>.","themselves,herself* actions,action",herself * actions,"his, her , whose * actions, words, places",R_A*S_V
"The excited sailor danced on the stern happily, while the captain gave his speech","The excited sailor <***> on the stern happily, while the captain <***> his speech after victory ","danced,dance* gave,given",danced* gave,"dances, cries, bathes * speech , son, laugh",S_V
 A bouquet of yellow roses lends color and fragrance to the room., A <***> of yellow roses <***> color and fragrance to the room.,"boquet,boquets * lends,lend",boquet * lends,"bouquet, banquet * lend , lends",S_V
The pilots that the architect admires are young and like to play football on their break.,The pilots that the architect admires <***> young and like to <***> football on their break.,"are,is* play,plays",are*play,"softened, hardened *  be, been ",S_V
Peter shot himself in the foot and Mary came to help him ,Peter shot <***> in the foot and Mary <***> to help him.,"himself,themselves * came,come",himself*came,"himself , herself * them , him ",R_A * S_V
"Everyone has problems , few people solve them ","Everyone <***> problems ,few people <***> them.","has,have * solve,solves",has*solve,"have , has * them , it ",S_V*N_P_I
"In matters of religion Levin, like most of his contemporaries, had very indefinite views, but he longed for peace","In matters of fighting Levin, like most of <***> contemporaries, <***>very indefinite views, but he <***> for peace.","his,him* longed,long",his*longed,"his, her * loaded, longed   ",S_V
My aunt or my uncle is arriving by train today and I am expecting choclates from them.,My aunt or my uncle <***> arriving by train today and I <***> expecting choclates from them.,"is,are*am,are",is*am,"My , Her * is arriving , are arriving ",S_V
"No one else existed except a soldier-beggar, two old women, and the dancing clergy.","<***> one else the except a soldier-beggar, two old women, and the <***> clergy.","no,never * dancing,dances",no*dancing,"A , an * them , the ",N_P_I*S_V 
"How wonderfully expressive her hand is!' he thought, recalling how they had sat at the corner table the day before.","How wonderfully expressive her hand <***>! he thought, recalling how they <***> sat at the corner table the day before.","is,are* had,has",is*had,"are, is * them, they ",S_V
He remembered how he had kissed the hand and afterwards examined the converging lines on the rosy palm.,He remembered how he <***> kissed the hand and afterwards examined the converging <***> on her rosy palm.,"had,have * lines,line",had*lines,"he, she * smile, lines",S_V
"Again Lordvmercypons! thought he, crossing himself, bowing, and watching the movements of the bowing deacon's flexible back.","Again 'Lordvmercypons!' thought he, crossing <***>, bowing, and <***> the movements of the bowing deacon's flexible back.","himself,themselves * watching,watches ",himself*watching ,"herself, himself * wasting , watching ",R_A  *  S_V
"The sealed-up thoughts began stirring in Levin's head, but he hastened to drive them away as he was running out of breath. ","The sealed-up thoughts <***> stirring in Levin's head, but he hastened to drive them away as he was <***> out of breath.","began,begin* running,runs ",began*running ,"he , her * fuming , running",S_V
the pilot that the skater likes laughs and the skater is learning to fly ,the pilot that the skater likes <***> and the skater <***> learning to fly,"laughs,laugh* is,are",laughs*is,"laugh, laughs * the, a ",S_V 
At the end he bows to the ground and likes to speak to Levin.,At the end he <***> to the ground and likes to <***> to Levin.,"bows,bow * speak,speaks",bows*speak ,"a, the * speaks, speak",S_V
"Christ, though unseen, is here present to receive your confession,' he said, pointing to a crucifix.","Christ, though unseen, <***> here present to receive your confession,' he <***>, pointing to they crucifix.","is,are * said,say",is*said,"are, is * them, the ",S_V
"I have doubted, and still doubt, everything,' replied Levin in a voice unpleasant to himself, and stopped.","I have doubted, and still <***>, everything, replied Levin in a voice unpleasant to <***>, and stopped.","doubt,doubts * himself,themselves ",doubt*himself ,"doubt , doubts * himself,themselves ",S_V*R_A
"The kid the mother likes, likes to play , dance and sing while he goes to school ","The kid the mother likes, likes to <***>, dance and sing while he <***> to school","play,plays*goes,go",play*goes,"play, plays * goes, go ",S_V
The worker the author plays with also like to sing and play the piano,The worker the author <***> with also <***> to sing and play the piano,"play,plays*like,likes",plays*likes,"laugh, laughs * gag, gags",S_V
The author is older than the fan who met him at the bookstore ,The author <***> older than the fan who <***> him at the bookstore,"is,are * met,meet",is*met,"is,are* on, at",S_V
The emperor the prince admires is young and likes to dance ,The emperor the prince <***> is young and <***> to dance ,"admires,admire * likes,like ",admires*likes ,"admire, admires * like , likes",S_V
"Tim carried a bucket while Tom carried a shovel, as they climbed the hill to dig up their fortune","The older man carried a bucket while the young lad carried a shovel, as <***> <***> the hill to dig up their fortune","they,them*climbed,climbs",they*climbed,"cast, casts * want, wants ",S_V
The author that the guard hates swims and dives,The author that the guard hates <***> and <***>,"swims,swim * dives,dive",swims*dives ,"swim,swims * dive, dives",S_V
"I am speaking of one who is not with us, because he is no more.","I am <***> of one who is not with us, because he <***> no more.","speaking,speaks *is,are",speaking *is ,"speaks, speaking * was, is ",S_V
"Do you know,' said Levin turning to his brother, 'Katavasov is writing a work on nutriment and...'","Do you know, said Levin <***> to his brother, Katavasov is <***> a work on nutriment and...'","turning,turns * writing,writes ",turning*writing ,"turns, turning * writes , writing ",S_V
the author that the guard loves is young while he was in his eighties ,the author that the guard <***> is young while he <***> in his eighties ,"loves,loving * was,were",loves*was,"love,loves * was, were",S_V
People who had so much as said a word about the affair were not welcome at the party,People who had so much as <***> a word about the affair were <***> welcome at the party,"said,say * never, ever",said*never,"said, says * not, never",S_V*N_P_I
"All the same, it's a pity that those two bears will be killed without you.","All the same, it's a pity that those two bears <***> be <***> without you.","will,shall * killed,kills",will*killed,"those,them * killed, kills ",S_V
"This custom of taking leave of celibacy is not without its reason,said Sergius Ivanich, grumpily","This custom of <***> leave of celibacy is not without its reason,' said Sergius Ivanich, <***>","taking,takes * grumpily,grump ",taking*grumpily ,"takes, taking * grupmpy, grumpily ",S_V
the consultant that likes the executive is young and wants to pray ,the consultant that likes the executive <***> young and <***> to pray,"is,are* wants,want",is*wants,"is,are * want, wants",S_V
A theory of physics ascertains that a body in motion stays in motion unless a force acts upon it ,A theory of physics <***> that a body in motion stays in motion unless a force <***> upon it,"ascertains,ascertain * acts,act",ascertains*acts,"ascertains, ascertain * act, acts",S_V
"Of course he feels so, but won't own up, said Katavasov, and burst out laughing.","Of course he <***> so, but won't own up,' said Katavasov, and <***> out laughing.","feels,feel * burst,bursting",feels*burst,"feel,feels * burst,bursts",S_V
"I am ready to swear I can't find in my soul a trace of regret for my freedom, said Levin, with a smile.","I <***> ready to swear I can't find in my soul a trace of <***> for my freedom,' said Levin, with a smile.","am,is * regret,regrets",am*regret ,"am,are * regrets, regret",S_V
"Ah, but your soul is filled in such chaos at the present moment that you are unable to find anything there!","Ah, but your soul is <***> in such chaos at the present moment that you are unable to <***> anything there!","filled,fills * find,found ",filled * find ,"fills, filled * finds, find",S_V
"Wait till you've settled down a bit, then you'll find it, said Katavasov.","Wait till you've <***> down a bit, then you'll <***> it, said Katavasov.","settled,settles * find,found ",settled * find ,"settles, settled * finds, find ",S_V
"But quite on the contrary, it is precisely of this loss of freedom that I am glad!","But quite on the contrary, it is precisely of this <***> of freedom that I <***> glad!","loss,losses * am,is ",loss * am ,"loss, losses * am , are",S_V
"Well, let us drink to his recovery, or let us wish that at least a hundredth part of his dreams come true.","Well, let us <***> to his recovery, or let us wish that at least a hundredth part of his dreams <***> true.","drink,drank * come,coming",drink * come,"drinks, drink * hundredth, hundred ",S_V
"Oh, what have I done!' he exclaimed, and kneeling before her he began kissing her hands.","Oh, what <***> I done!' he <***>, and kneeling before her he began kissing her hands.","have,has* exclaimed,exclaim ",have * exclaimed ,"have , has * exclaims, exclaimed ",S_V
"Guilty and ashamed, but comforted, Levin returned to his hotel.","Guilty and ashamed, but <***>, Levin <***> to his hotel.","comforted,comforts * returned,returns ",comforted * returned ,"comfort,comforted * return , returned ",S_V
"His brother, Dolly, and Oblonsky, all in evening dress, were waiting to bless him with the icon.","His brother, Dolly, and Oblonsky, all in evening dress, <***> <***> to bless him with the icon.","were,was * waiting,waits ",were * waiting ,"was,were * wait, waiting ",S_V 
"Then a carriage had to be sent to fetch the groomsman, and another was to take Sergius Ivanich and return again.","Then a carriage <***> to be sent to fetch the groomsman, and another was to <***> Sergius Ivanich and return again.","had,have * take,took ",had * take ,"has, had * take, takes",S_V
"Dolly did the same, then she hurried away and again became confused about the arrangements for the carriages.","Dolly <***> the same, then she hurried away and again became <***> about the arrangements for the carriages.","did,does*confused,confuse",did*confused,"does,did * confuse, confused ",S_V
"A CROWD OF PEOPLE, mostly women, had assembled outside the church, which was brightly lit up for the wedding.","A CROWD OF PEOPLE, mostly women, <***> assembled outside the church, which <***> brightly lit up for the wedding.","had,have * was,were ",had * was ,"has,had * was, were ",S_V
More than twenty carriages had already been ranged along the street by the mounted police.,More than twenty carriages <***> already <***> ranged along the street by the mounted police.,"had,have * been,be ",had * been ,"has, had * be, been ",S_V 
"Inside the building the candles in both chandeliers were already lit, as well as all the candles in front of the icons had also been lit.","Inside the building the candles in both chandeliers <***> already lit, as well as all the candles in front of the icons <***>also been lit.","were,was*had,having",were*had,"was,were * have,had",S_V
"Every time the door creaked every one turned round, expecting to see the bride and bridegroom enter.","Every time the door <***>, every one turned round, <***> to see the bride and bridegroom enter.","creaked,creak * expecting,expected",creaked * expecting,"creaked,creaks * expecting,expects",S_V
"At first they expected the bride and bridegroom to enter at any moment, and attached no importance to the delay.","At first they <***> the bride and bridegroom to enter at any moment, and <***> no importance to the delay.","expected,expecting*attached,attaching",expected*attached ,,S_V
"Then they turned more and more often toward the door, wondering whether anything had happened.","Then they <***> more and more often toward the door, wondering whether anything <***> happened.","turned,turns*had,have ",turned*had ,,S_V
"The archdeacon, as if to draw attention to the value of his time, coughed impatiently, making the windows vibrate.","The archdeacon, as if to <***> attention to the value of his time, <***> impatiently, making the windows vibrate.","draw,drew*coughed,cough",draw*coughed,,S_V
"From the choir, growing weary of waiting, came the sound of voices being tried and the blowing of noses.","From the choir, <***> weary of waiting, came the sound of voices <***> tried and the blowing of noses.","growing,grow*being,been",growing*being ,,S_V
The best man went to find out what had occurred.,The best man <***> to find out what <***> occurred.,"went,go*had,have",went*had,,S_V
"But in the corridor there was nobody, and in despair he returned and addressed Oblonsky, who was quietly smoking.","But in the corridor there <***> nobody, and in despair he returned and addressed Oblonsky, who <***> quietly smoking.","was,were*was,is",was*was,,S_V
The shirt Levin had been wearing since the morning was crumpled and quite unfit to wear with the fashionable low-cut waistcoat.,The shirt Levin <***> wearing since the morning<***> crumpled and quite unfit to wear with the fashionable low-cut waistcoat.,"had,have*was,were",had*was,,S_V
"They sent for one of Oblonsky's, but it was much too wide and too short.","They <***> for one of Oblonsky's, but it <***> much too wide and too short.","sent,sending *was,were",sent*was,,S_V
"They were obliged to send to the Shcherbatskys' after all, and the things had to be unpacked.","They <***> obliged to send to the Shcherbatskys' after all, and the things <***> to be unpacked.","were,was*had,have",were*had,,S_V
"At last the guilty Kuzma, quite out of breath, rushed in with the shirt. was found unconscious.","At last the guilty Kuzma, quite out of breath, <***> in with the shirt <***> found unconscious.","rushed,rushes*was,were",rushed*was,,S_V
"Only just in time – they were hoisting the trunk into the cart,' he gasped.","Only just in time – they <***> hoisting the trunk into the cart,' he <***>.","were,was*gasped,gasps",were*gasped,,S_V
"Three minutes later Levin, not looking at the clock to avoid upsetting himself still more, ran as fast as he could down the corridor.","Three minutes later Levin, not looking at the clock to avoid upsetting <***> still more, ran as fast as he <***> down the corridor.","himself,herself*could,would",himself*could,,R_A*S_V
"That won't help matters,' remarked Oblonsky, smiling and following without haste.","That <***> help matters,' <***> Oblonsky, smiling and following without haste.","won't,can't*remarked,remarks",won't*remarked,,S_V
More dead than alive!' people in the crowd were saying as Levin met his bride at the door and entered the church with her.,More dead than alive!' people in the crowd <***> saying as Levin <***> his bride at the door and <***> the church with her.,"were,was*met,meet*entered,enters",were*met*entered,,S_V
"Oblonsky told his wife the reason of the delay, and the guests smiled and whispered to one another.","Oblonsky <***> his wife the reason of the delay, and the guests<***> and <***> to one another.","told,said*smiled,smiles*whispered,whispers",told*smiled*whispered,,S_V
Levin saw no one and nothing; he did not take his eyes off his bride.,Levin <***> no one and nothing; he did not <***> his eyes off his bride.,"saw,see*take,took ",saw*take,,S_V*N_P_I
"I thought you meant to run away,' she said, smiling at him.","I thought you <***> to run away,' she said, <***> at him.","meant,mean*smiling,smiles ",meant*smiling ,,S_V
"I am ashamed to tell it,' he said with a blush, and was obliged to turn round to the approaching Sergius Ivanich.","I<***> ashamed to tell it,' he said with a blush, and <***>obliged to turn round to the approaching Sergius Ivanich.","am,is*was,were",am*was,,S_V
"Nice story that, about your shirt!' said Sergius Ivanich with a smile and shake of the head tilting away with sigh of relief.","Nice story that, about your shirt!' <***> Sergius Ivanich with a smile and shake of the head <***> away with sigh of relief.","said,says*tilting,tilt",said*tilting,,S_V
"Yes, yes!' answered Levin, unable to understand what was being said.","Yes, yes!' <***> Levin, unable to understand what <***> being said.","answered,answers*was,were",answered*was,,S_V
"You have got to decide an important point, and you are in exactly the right frame of mind to appreciate its importance.","You <***> got to decide an important point, and you <***> in exactly the right frame of mind to appreciate its importance.","have,having*are,is",have*are,,S_V
"Dolly advanced and was about to say something, but could not speak and began crying and laughing in an unnatural manner.","Dolly advanced and <***> about to say something, but <***> speak and began crying and laughing in an unnatural manner.","was,were*couldn't,shouln't",was*couldn't,,S_V*N_P_I
Kitty gazed at everybody with a look as absent-minded as Levin's and became a fool himself.,Kitty <***> at everybody with a look as absent-minded as Levin's and became fool <***>.,"gazed,gaze* himself,themselves",gazed* himself ,,S_V*R_A
Meanwhile the clergy put on their vestments and the priest and deacon came forward to the lectern that stood near the entrance doors.,Meanwhile the clergy put on their vestments and the priest and deacon <***> forward to the lectern that <***> near the entrance doors.,"came,come*stood,stand",came*stood,,S_V
The priest turned to Levin and said something that Levin did not hear.,The priest <***> to Levin and said something that Levin <***> hear.,"turned,turns*didn't,doesn't",turned*didn't ,,S_V*N_P_I
"Take the bride's hand and lead her,' said the best man.","<***> the bride's hand and lead her,' <***> the best man.","take,took*said,say",take*said,,S_V
"When at last he had taken her hand properly, the priest went a few steps in front of them and halted at the lectern.","When at last he <***> taken her hand properly, the priest <***> a few steps in front of them and halted at the lectern.","had,have*went,go",had*went,,S_V
"The crowd of friends and relatives, their voices buzzing and the ladies' trains rustling, moved after them.","The crowd of friends and relatives, their <***> buzzing and the ladies' trains rustling, <***>after them.","voices,voice*moved,moves",voices*moved,,S_V
The two friends decided to go sky-diving after their graduation as they were adrenaline junkies,The two friends decided to go sky-diving after <***> graduation as they <***> adrenaline junkies,"them,their*was,were",their*were,,S_V
The church became so quiet that the drops of wax were heard falling from the candles.,The church <***> so quiet that the drops of wax <***> heard falling from the candles.,"became,become*were,was",became*were,,S_V
"Oblonsky stepped up cautiously, whispered something to him, made a sign to Levin, and stepped back again.","Oblonsky <***> up cautiously, <***> something to him, made a sign to Levin, and <***> back again.","stepped,stepp*whispered,whispers*stepped,steps",stepped*whispered*stepped,,S_V
It was the same priest who had heard Levin's confession.,It <***> the same priest who <***> heard Levin's confession.,"was,were*had,have",was*had,,S_V
"Then he gave them the candles, took the censer, and slowly stepped away from them.","Then he <***> them the candles, <***> the censer, and slowly <***> away from them.","gave,give*took,take*stepped,steps",gave*took*stepped,,S_V
"Is it really true?' thought Levin, and glanced round at his bride.","<***> it really true?' thought Levin, and <***> round at his bride.","Is,were*glanced,glances",Is*glanced,,S_V
"She did not turn, but her high frilled collar moved, rising to her pink little ear.","She did not <***> , but her high frilled collar <***>, rising to her pink little ear.","turn,turns*moved,moves",turn*moved,,N_P_I*S_V
He saw that a sigh had been suppressed within her breast and that the little hand in its long glove holding the candle trembled.,He <***> that a sigh <***> been suppressed within her breast and that the little hand in its long glove holding the candle trembled.,"saw,see*had,have",saw*had,,S_V
"Bless us, Lord!' slowly succeeding one another, and vibratingly resonant, came the solemn tones.","Bless us, Lord!' slowly <***> one another, and vibratingly resonant, <***> the solemn tones.","suceeding,suceed*came,come",suceeding*came,,S_V
Levin listened to the words and was struck by them.,Levin <***> to the words and <***> struck by them.,"listened,listen*was,were",listened*was,,S_V
"How did they find out that it is help, exactly help that I need?' he wondered, remembering his late fears and doubts.","How did they <***> out that it is help, exactly help that I need?' he <***>, remembering his late fears and doubts.","find,found*wondered,wonders",find*wondered,,S_V
What can I do in this awful matter without help from themselves?,What can I <***>in this awful matter without help from <***>?,"do,did*themselves",do*themselves,,S_V*R_A
"When the deacon had finished the prayer for the Imperial family, the priest holding a book turned to the bride and bridegroom.","When the deacon <***> finished the prayer for the Imperial family, the priest <***> a book turned to the bride and bridegroom.","had,have*holding,hold",had*holding,,S_V
"I am quite satisfied,” replied the worthy merchant; “I have sold my cotton at three hundred and seventy-five per cent. profit.","I <***> quite satisfied,” replied the worthy merchant; “I <***> sold my cotton at three hundred and seventy-five per cent. profit.","am,is*have,had",am*have,,S_V
"“Are you pleased with the charming cargo I brought you on board the Dolphin?” continued Captain Playfair, showing him his brave young wife","“Are you <***> with the charming cargo I <***> you on board the Dolphin?” continued Captain Playfair, showing him his brave young wife","pleased,please*brought,buy",pleased*brought,,S_V
From the expression in them he concluded that she understood them as he did; but this was not so.,From the expression in them he <***>that she <***>them as he did; but this<***> not so.,"concluded,concludes*understood,understand*was,were",concluded*understood*was,,S_V
She understood hardly anything of the service and was not even listening to the words of the ceremony.,She <***> hardly anything of the service and <***> not even listening to the words of the ceremony.,"understood,understand*was,were",understood*was,,S_V
"She could neither listen nor understand, so deep was the one feeling that filled her soul and became ever stronger and stronger.","She<***> neither listen nor understand, so deep <***> the one feeling that filled her soul and became ever stronger and stronger.","could,would*was,were",could*was,,S_V
Those six weeks had been the most blissful and at the same time the most trying of her life.,Those six weeks <***> the most blissful and at the same time the most <***> of her life.,"had,have*trying,try",had*trying,,S_V
"At one moment she was horrified at this indifference, and the next moment rejoiced at that which caused her indifference.","At one moment she <***> horrified at this indifference, and the next moment <***>at that which caused her indifference.","was,were*rejoiced,rejoice",was*rejoiced,,S_V
"Several times the couple tried to guess what was expected of them, and blundered each time, the priest prompting them in whispers.","Several times the couple <***> to guess what was expected of them, and <***> each time, the priest prompting them in whispers.","tried,tries*blundered,blunders",tried*blundered,,S_V
"Dolly, Chirikov, and Oblonsky came forward to help them by collecting money from people.","Dolly, Chirikov, and Oblonsky <***> forward to help them by <***> money from people.","came,cames*collecting,collects",came*collecting,,S_V
He felt that any kind of smile would hurt their feelings.,He <***> that any kind of smile <***> hurt their feelings.,"felt,fell*would,should",felt*would,,S_V
"Thou hast from the beginning created them male and female,' read the priest when they had exchanged rings.","Thou hast from the beginning <***> them male and female,' read the priest when they<***> exchanged rings.","created,creates*had,have",created*had,,S_V
Through Thee the wife is knit to the husband for a helpmeet and to procreate the human race.,Through Thee the wife<***> knit to the husband for a helpmeet and to <***> the human race.,"is,are*procreate,procreates",is*procreate,,S_V
"ALL Moscow, including both relatives and friends, had congregated in the church.","ALL Moscow, including both relatives and friends, <***> <***>  the church.","congregated,congregates*in,on",congregated*in,,S_V
"It was usually started by the men, for the women were absorbed in watching every detail of the service, which always fascinates them.","It <***> usually started by the men, for the women <***> absorbed in watching every detail of the service, which always fascinates them.","was,am*were,is",was*were,,S_V
"It is almost as unsuitable at a wedding as black,' remarked Mrs. Korsunskaya.","It <***> almost as unsuitable at a wedding as black,' <***> Mrs. Korsunskaya.","is,are*remarked,remarks",is*remarked,,S_V
"With her complexion it's her only salvation,' replied Princess Drubetskaya.","With her complexion it <***> her only salvation,' <***>Princess Drubetskaya.","is,are*replied,replies",is*replied,,S_V
